{
 "overlay_profile": "ori-plan-overlay-0.1",
 "label": "Reviewer evidence, not approval",
 "overlay_id": "urn:ori:overlay:groundtruth:ori-sample-house-noisy.pdf",
 "status": "DRAFT",
 "created_at": "2026-10-03T00:00:00Z",
 "tool": {
  "name": "ori_takeoff",
  "version": "0.1.0",
  "dependencies": [
   "pdfplumber (MIT)",
   "ezdxf (MIT)",
   "shapely (BSD-3-Clause)",
   "ifcopenshell (LGPL-3.0-or-later)"
  ]
 },
 "source": {
  "artifact_id": "urn:ori:artifact:sha256:6f381f2d13c2bb28163d55ef4ce2c8301bd49d8906bbee96096ef631fbd92f35",
  "filename": "ori-sample-house-noisy.pdf",
  "media_type": "application/pdf",
  "sha256": "6f381f2d13c2bb28163d55ef4ce2c8301bd49d8906bbee96096ef631fbd92f35",
  "size_bytes": 42756,
  "page_count": 2
 },
 "license_record": {
  "license_id": "CC0-1.0",
  "license_basis": "ORI-authored synthetic plan, dedicated to the public domain by the ORI project (LICENSE-SPEC.md)",
  "license_url": "https://creativecommons.org/publicdomain/zero/1.0/legalcode",
  "license_local_path": "research/licenses/cc0-1.0-legalcode.txt",
  "license_sha256": "a2010f343487d3f7618affe54f789f5487602331c0a8d03f49e9a7c547cf0499",
  "license_fetched_at": "2026-09-28",
  "license_confirmed": true,
  "source_url": "https://github.com/corelotorg/OpenPermit/tree/test/verification/examples/takeoff",
  "source_citation": {
   "author": "ORI project (Open Regulatory Infrastructure)",
   "title": "ORI sample single-family plan (synthetic)",
   "year": "2026",
   "publisher": "ORI / OpenPermit repository",
   "identifier": "verification/ori_takeoff/sample_plan.py",
   "archive_url": "https://github.com/corelotorg/OpenPermit/tree/test/verification/examples/takeoff",
   "accessed": "2026-10-03"
  },
  "training_use": "allowed",
  "license_note": "Generated by code in this repository; the source URL is the canonical repo path and resolves once this tree is published on the main branch."
 },
 "dataset_role": "ground_truth",
 "pages": [
  {
   "page": 1,
   "page_label": "A-101",
   "sheet_title": "FIRST FLOOR PLAN",
   "kind": "vector",
   "status": "ground_truth",
   "size_page_units": [
    1728.0,
    1296.0
   ],
   "page_units": "pt",
   "scale": {
    "status": "stated_confirmed",
    "real_in_per_page_unit": 0.666666667,
    "stated": {
     "text": "SCALE: 1/4\" = 1'-0\"",
     "real_in_per_paper_in": 48.0
    },
    "calibration": null,
    "note": "Authored scale."
   },
   "storey": {
    "name": "Level 1",
    "elevation_in": 0.0,
    "elevation_origin": "sample design data",
    "floor_to_floor_in": 105.0,
    "ceiling_height_in": 96.0
   },
   "elements": [
    {
     "id": "p1-WS",
     "ifc_class": "IfcWall",
     "predefined_type": "SOLIDWALL",
     "name": "WS",
     "geometry_page": {
      "type": "Polygon",
      "coordinates": [
       [
        [
         218.278,
         319.484
        ],
        [
         794.264,
         323.505
        ],
        [
         794.201,
         332.505
        ],
        [
         218.215,
         328.484
        ],
        [
         218.278,
         319.484
        ]
       ]
      ]
     },
     "geometry_real": {
      "type": "Polygon",
      "coordinates": [
       [
        [
         145.519,
         212.989
        ],
        [
         529.509,
         215.67
        ],
        [
         529.467,
         221.67
        ],
        [
         145.477,
         218.989
        ],
        [
         145.519,
         212.989
        ]
       ]
      ]
     },
     "properties": {
      "thickness_in": 6.0,
      "length_in": 378.0,
      "exterior": true
     },
     "relations": {},
     "provenance": {
      "method": "authored_ground_truth",
      "tool": "ori_takeoff 0.1.0 (editor/authoring)",
      "tool_version": "0.1.0",
      "confidence": 1.0,
      "rule": "sample_plan design data",
      "by": "ORI sample_plan.py",
      "at": "2026-10-03T00:00:00Z",
      "review_status": "confirmed",
      "derived_from": null
     },
     "axis_page": {
      "type": "LineString",
      "coordinates": [
       [
        222.746,
        324.015
       ],
       [
        789.732,
        327.974
       ]
      ]
     },
     "axis_real": {
      "type": "LineString",
      "coordinates": [
       [
        148.497,
        216.01
       ],
       [
        526.488,
        218.649
       ]
      ]
     }
    },
    {
     "id": "p1-WN",
     "ifc_class": "IfcWall",
     "predefined_type": "SOLIDWALL",
     "name": "WN",
     "geometry_page": {
      "type": "Polygon",
      "coordinates": [
       [
        [
         214.822,
         814.472
        ],
        [
         790.808,
         818.493
        ],
        [
         790.745,
         827.493
        ],
        [
         214.759,
         823.472
        ],
        [
         214.822,
         814.472
        ]
       ]
      ]
     },
     "geometry_real": {
      "type": "Polygon",
      "coordinates": [
       [
        [
         143.215,
         542.981
        ],
        [
         527.205,
         545.662
        ],
        [
         527.163,
         551.662
        ],
        [
         143.173,
         548.981
        ],
        [
         143.215,
         542.981
        ]
       ]
      ]
     },
     "properties": {
      "thickness_in": 6.0,
      "length_in": 378.0,
      "exterior": true
     },
     "relations": {},
     "provenance": {
      "method": "authored_ground_truth",
      "tool": "ori_takeoff 0.1.0 (editor/authoring)",
      "tool_version": "0.1.0",
      "confidence": 1.0,
      "rule": "sample_plan design data",
      "by": "ORI sample_plan.py",
      "at": "2026-10-03T00:00:00Z",
      "review_status": "confirmed",
      "derived_from": null
     },
     "axis_page": {
      "type": "LineString",
      "coordinates": [
       [
        219.29,
        819.003
       ],
       [
        786.277,
        822.962
       ]
      ]
     },
     "axis_real": {
      "type": "LineString",
      "coordinates": [
       [
        146.193,
        546.002
       ],
       [
        524.185,
        548.641
       ]
      ]
     }
    },
    {
     "id": "p1-WW",
     "ifc_class": "IfcWall",
     "predefined_type": "SOLIDWALL",
     "name": "WW",
     "geometry_page": {
      "type": "Polygon",
      "coordinates": [
       [
        [
         218.278,
         319.484
        ],
        [
         227.278,
         319.547
        ],
        [
         223.759,
         823.535
        ],
        [
         214.759,
         823.472
        ],
        [
         218.278,
         319.484
        ]
       ]
      ]
     },
     "geometry_real": {
      "type": "Polygon",
      "coordinates": [
       [
        [
         145.519,
         212.989
        ],
        [
         151.519,
         213.031
        ],
        [
         149.173,
         549.023
        ],
        [
         143.173,
         548.981
        ],
        [
         145.519,
         212.989
        ]
       ]
      ]
     },
     "properties": {
      "thickness_in": 6.0,
      "length_in": 330.0,
      "exterior": true
     },
     "relations": {},
     "provenance": {
      "method": "authored_ground_truth",
      "tool": "ori_takeoff 0.1.0 (editor/authoring)",
      "tool_version": "0.1.0",
      "confidence": 1.0,
      "rule": "sample_plan design data",
      "by": "ORI sample_plan.py",
      "at": "2026-10-03T00:00:00Z",
      "review_status": "confirmed",
      "derived_from": null
     },
     "axis_page": {
      "type": "LineString",
      "coordinates": [
       [
        222.746,
        324.015
       ],
       [
        219.29,
        819.003
       ]
      ]
     },
     "axis_real": {
      "type": "LineString",
      "coordinates": [
       [
        148.497,
        216.01
       ],
       [
        146.193,
        546.002
       ]
      ]
     }
    },
    {
     "id": "p1-WE",
     "ifc_class": "IfcWall",
     "predefined_type": "SOLIDWALL",
     "name": "WE",
     "geometry_page": {
      "type": "Polygon",
      "coordinates": [
       [
        [
         785.264,
         323.442
        ],
        [
         794.264,
         323.505
        ],
        [
         790.745,
         827.493
        ],
        [
         781.745,
         827.43
        ],
        [
         785.264,
         323.442
        ]
       ]
      ]
     },
     "geometry_real": {
      "type": "Polygon",
      "coordinates": [
       [
        [
         523.509,
         215.628
        ],
        [
         529.509,
         215.67
        ],
        [
         527.163,
         551.662
        ],
        [
         521.163,
         551.62
        ],
        [
         523.509,
         215.628
        ]
       ]
      ]
     },
     "properties": {
      "thickness_in": 6.0,
      "length_in": 330.0,
      "exterior": true
     },
     "relations": {},
     "provenance": {
      "method": "authored_ground_truth",
      "tool": "ori_takeoff 0.1.0 (editor/authoring)",
      "tool_version": "0.1.0",
      "confidence": 1.0,
      "rule": "sample_plan design data",
      "by": "ORI sample_plan.py",
      "at": "2026-10-03T00:00:00Z",
      "review_status": "confirmed",
      "derived_from": null
     },
     "axis_page": {
      "type": "LineString",
      "coordinates": [
       [
        789.732,
        327.974
       ],
       [
        786.277,
        822.962
       ]
      ]
     },
     "axis_real": {
      "type": "LineString",
      "coordinates": [
       [
        526.488,
        218.649
       ],
       [
        524.185,
        548.641
       ]
      ]
     }
    },
    {
     "id": "p1-V1",
     "ifc_class": "IfcWall",
     "predefined_type": "SOLIDWALL",
     "name": "V1",
     "geometry_page": {
      "type": "Polygon",
      "coordinates": [
       [
        [
         524.207,
         330.62
        ],
        [
         530.957,
         330.667
        ],
        [
         527.564,
         816.655
        ],
        [
         520.815,
         816.608
        ],